{
  "schema": "ferris.command-result/v2",
  "command_version": "0.1.0",
  "semantic_command_id": "profile-diff",
  "selection_identity": "selection:76d594118b3e213855c32c27307c48756350fe9851b272813cadd3fc5023754b",
  "invocation_identity": "invocation:21b4bcaa6acaa85dd59cf956eafd7d0fe88697a677fb7e4c5c5a57050f3ba981",
  "result_identity": "result:e73c0465e78bfd2bdc46f0046ecdbcacc0ae8687a2efa6a262cca9b1bd4d5fef",
  "result_class": "success",
  "process_exit_code": 0,
  "diagnostics": [],
  "record": {
    "schema": "ferris.profile-diff/v0",
    "diff_id": "profile-diff:1297568c207eee7fc4837f178d04ae278e52196dc5811dd2a7f2bcc898622c5f",
    "before": {
      "profile_id": "public.vector/profile",
      "revision": "r1",
      "consumer": "public-custodian",
      "content_digest": "sha256:54cef89f1fbc77019c05534fef2817040883cda5c51fc365d881e03ff612df39"
    },
    "after": {
      "profile_id": "public.vector/profile",
      "revision": "r1",
      "consumer": "public-custodian",
      "content_digest": "sha256:54cef89f1fbc77019c05534fef2817040883cda5c51fc365d881e03ff612df39"
    },
    "changed_sections": [],
    "changes": [],
    "unchanged_sections": [
      "assurance",
      "closure",
      "features",
      "identity",
      "lifecycle",
      "native",
      "providers",
      "stages",
      "stewardship",
      "support",
      "targets",
      "toolchain"
    ],
    "unknowns": [
      "Semantic equivalence and compatibility are not assessed.",
      "Support, freshness, approval, and decision authority are not assessed."
    ],
    "limitations": [
      "This record compares only explicit caller-provided evidence and does not interpret support, compatibility, approval, correctness, freshness, or readiness.",
      "Ferris did not generate either profile, invoke an owner tool, discover files, contact a network, select packages, or mutate input, repository, or environment state.",
      "Value digests identify compared JSON values; raw section values are intentionally omitted.",
      "Profile identifiers, revisions, consumers, and JSON object keys are output-visible metadata; callers must not place secrets in those fields."
    ],
    "executable": false
  }
}
